{
  "schema_version": 1,
  "run_id": "20260912-research-cifar10",
  "active": true,
  "phase": "research",
  "phase_status": "running",
  "started_at": "2026-09-14T01:46:02Z",
  "updated_at": "2026-09-14T05:46:02Z",
  "completed_at": null,
  "run_outcome": null,
  "completion_audit": null,
  "completed_phases": {
    "ideation": {
      "completed_at": "2026-09-14T04:46:02Z"
    }
  },
  "state": {
    "orchestrator": {
      "next_action": "review_worker_result",
      "current_node": "node-005",
      "iteration": 21
    },
    "baseline_status": "provided_by_contract",
    "nodes": {
      "node-001": {
        "status": "accepted",
        "parent_node_id": null,
        "updated_at": "2026-09-14T05:45:32Z"
      },
      "node-002": {
        "status": "accepted",
        "parent_node_id": "node-001",
        "updated_at": "2026-09-14T05:45:32Z"
      },
      "node-003": {
        "status": "invalid",
        "parent_node_id": null,
        "updated_at": "2026-09-14T05:45:32Z"
      },
      "node-004": {
        "status": "rejected",
        "parent_node_id": "node-001",
        "updated_at": "2026-09-14T05:45:32Z"
      },
      "node-005": {
        "status": "running",
        "parent_node_id": "node-002",
        "updated_at": "2026-09-14T05:45:32Z"
      },
      "node-006": {
        "status": "accepted",
        "parent_node_id": null,
        "updated_at": "2026-09-14T05:45:32Z"
      },
      "node-007": {
        "status": "implementing",
        "parent_node_id": "node-006",
        "updated_at": "2026-09-14T05:45:32Z"
      },
      "node-008": {
        "status": "repairing",
        "parent_node_id": "node-002",
        "updated_at": "2026-09-14T05:45:32Z"
      },
      "node-009": {
        "status": "planned",
        "parent_node_id": "node-005",
        "updated_at": "2026-09-14T05:45:32Z"
      },
      "node-010": {
        "status": "candidate",
        "parent_node_id": "node-006",
        "updated_at": "2026-09-14T05:45:32Z"
      }
    },
    "work": {
      "worker-node-005": {
        "status": "running",
        "node_id": "node-005",
        "updated_at": "2026-09-14T05:27:32Z",
        "result_ref": ".ai-scientist/runs/20260912-research-cifar10/logs/workers/node-005/worker-node-005/result.md"
      },
      "worker-node-007": {
        "status": "implementing",
        "node_id": "node-007",
        "updated_at": "2026-09-14T05:38:32Z",
        "result_ref": ".ai-scientist/runs/20260912-research-cifar10/logs/workers/node-007/worker-node-007/result.md"
      },
      "worker-node-008": {
        "status": "repairing",
        "node_id": "node-008",
        "updated_at": "2026-09-14T05:43:32Z",
        "result_ref": ".ai-scientist/runs/20260912-research-cifar10/logs/workers/node-008/worker-node-008/result.md"
      },
      "revision-node-008-r1": {
        "status": "completed",
        "node_id": "node-008",
        "updated_at": "2026-09-14T05:41:32Z",
        "result_ref": ".ai-scientist/runs/20260912-research-cifar10/logs/revisions/node-008/revision-node-008-r1/result.md"
      },
      "worker-node-009": {
        "status": "queued",
        "node_id": "node-009",
        "updated_at": "2026-09-14T05:44:32Z"
      },
      "worker-node-010": {
        "status": "validating",
        "node_id": "node-010",
        "updated_at": "2026-09-14T05:35:32Z"
      }
    },
    "subagents": {
      "worker-node-005": {
        "status": "running"
      },
      "worker-node-007": {
        "status": "running"
      },
      "worker-node-008": {
        "status": "running"
      }
    },
    "resources": {
      "leases": {
        "lease-7": {
          "task_id": "worker-node-005",
          "status": "running",
          "gpus": 1
        }
      }
    },
    "selected_node": null
  }
}
