{
  "active": false,
  "completed_at": "2026-04-29T00:00:00Z",
  "completion_audit": {
    "passed": true,
    "prompt_to_artifact_checklist": [
      "One requested idea was attempted and finalized"
    ],
    "verification_evidence": [
      ".ai-scientist/ideas/ideas.json contains finalized idea-001"
    ]
  },
  "completed_phases": {
    "ideation": {
      "active": false,
      "completed_at": "2026-04-29T00:00:00Z",
      "completion_audit": {
        "passed": true,
        "prompt_to_artifact_checklist": [
          "One requested idea was attempted and finalized"
        ],
        "verification_evidence": [
          ".ai-scientist/ideas/ideas.json contains finalized idea-001"
        ]
      },
      "phase": "ideation",
      "phase_status": "complete",
      "run_id": "run-001",
      "schema_version": 1,
      "state": {
        "current_idea_index": 1,
        "current_reflection_round": 1,
        "finalized_count": 1,
        "idea_states": {
          "idea-001": {
            "finalization_decision": "finalize",
            "reflection_count": 1,
            "status": "finalized"
          }
        },
        "num_ideas_required": 1,
        "num_reflections_required": 1,
        "s2_query_count": 1,
        "skipped_count": 0
      }
    }
  },
  "phase": "ideation",
  "phase_status": "complete",
  "run_id": "run-001",
  "schema_version": 1,
  "state": {
    "current_idea_index": 1,
    "current_reflection_round": 1,
    "finalized_count": 1,
    "idea_states": {
      "idea-001": {
        "finalization_decision": "finalize",
        "reflection_count": 1,
        "status": "finalized"
      }
    },
    "num_ideas_required": 1,
    "num_reflections_required": 1,
    "s2_query_count": 1,
    "skipped_count": 0
  },
  "updated_at": "2026-04-29T00:00:00Z"
}
