{
  "schema_version": 1,
  "run_id": "20260901-research-codesearch-cancelled",
  "active": false,
  "phase": "research",
  "phase_status": "cancelled",
  "started_at": "2026-09-03T15:47:32Z",
  "updated_at": "2026-09-03T19:47:32Z",
  "completed_at": "2026-09-03T19:47:32Z",
  "run_outcome": "cancelled",
  "completion_audit": null,
  "completed_phases": {
    "ideation": {
      "completed_at": "2026-09-03T18:47:32Z"
    }
  },
  "state": {
    "orchestrator": {
      "next_action": "cancelled"
    }
  }
}
