{
  "schema_version": 1,
  "run_id": "20260905-writeup-energy",
  "active": false,
  "phase": "writeup",
  "phase_status": "complete",
  "started_at": "2026-09-11T23:47:32Z",
  "updated_at": "2026-09-12T03:47:32Z",
  "completed_at": "2026-09-12T03:47:32Z",
  "run_outcome": "positive",
  "completion_audit": null,
  "completed_phases": {
    "ideation": {
      "completed_at": "2026-09-12T02:47:32Z"
    },
    "research": {
      "completed_at": "2026-09-12T02:47:32Z"
    },
    "review": {
      "completed_at": "2026-09-12T02:47:32Z"
    },
    "writeup": {
      "completed_at": "2026-09-12T02:47:32Z"
    }
  },
  "state": {
    "orchestrator": {
      "next_action": "done"
    },
    "selected_node": "node-001"
  }
}
