{
  "schema_version": 1,
  "run_id": "20260913-ideation-agnews",
  "active": true,
  "phase": "ideation",
  "phase_status": "running",
  "started_at": "2026-09-14T01:43:32Z",
  "updated_at": "2026-09-14T05:43:32Z",
  "completed_at": null,
  "run_outcome": null,
  "completion_audit": null,
  "completed_phases": {},
  "state": {
    "orchestrator": {
      "next_action": "dispatch_critic",
      "iteration": 5,
      "next_action_details": {
        "idea_id": "idea-03"
      }
    },
    "ideas": {},
    "subagents": {
      "critic-3": {
        "status": "running"
      }
    }
  }
}
