{
  "schema_version": 1,
  "run_id": "20260910-review-housing",
  "active": true,
  "phase": "review",
  "phase_status": "running",
  "started_at": "2026-09-14T01:12:32Z",
  "updated_at": "2026-09-14T05:12:32Z",
  "completed_at": null,
  "run_outcome": null,
  "completion_audit": null,
  "completed_phases": {
    "ideation": {
      "completed_at": "2026-09-14T04:12:32Z"
    },
    "research": {
      "completed_at": "2026-09-14T04:12:32Z"
    }
  },
  "state": {
    "orchestrator": {
      "next_action": "structured_review",
      "iteration": 1
    },
    "selected_node": "node-003",
    "selection": {
      "selected_node": "node-003"
    }
  }
}
