{
  "active": false,
  "completed_at": "2026-04-29T00:00:00Z",
  "completion_audit": {
    "passed": true,
    "prompt_to_artifact_checklist": [
      "Baseline and accepted node evidence are present"
    ],
    "verification_evidence": [
      ".ai-scientist/runs/run-001/nodes/node-001 contains metrics and integrity checks"
    ]
  },
  "completed_phases": {
    "research": {
      "active": false,
      "completed_at": "2026-04-29T00:00:00Z",
      "completion_audit": {
        "passed": true,
        "prompt_to_artifact_checklist": [
          "Baseline and accepted node evidence are present"
        ],
        "verification_evidence": [
          ".ai-scientist/runs/run-001/nodes/node-001 contains metrics and integrity checks"
        ]
      },
      "phase": "research",
      "phase_status": "complete",
      "run_id": "run-001",
      "schema_version": 1,
      "state": {
        "baseline_status": "complete",
        "current_node": "node-001",
        "iteration": 1,
        "max_iterations": 1,
        "node_queue": [],
        "nodes": {
          "node-001": {
            "attempt": 1,
            "status": "accepted"
          }
        },
        "selected_node": "node-001"
      }
    }
  },
  "phase": "research",
  "phase_status": "complete",
  "run_id": "run-001",
  "schema_version": 1,
  "state": {
    "baseline_status": "complete",
    "current_node": "node-001",
    "iteration": 1,
    "max_iterations": 1,
    "node_queue": [],
    "nodes": {
      "node-001": {
        "attempt": 1,
        "status": "accepted"
      }
    },
    "selected_node": "node-001"
  },
  "updated_at": "2026-04-29T00:00:00Z"
}
